{
  "schemaVersion": 1,
  "kind": "resq-release-audit",
  "framework": "resQ",
  "status": "pass",
  "commit": "3d3f9852962fb194f9d8cf70b70da542be331b93",
  "startedAt": "2026-08-14T11:49:39.998370Z",
  "finishedAt": "2026-08-14T11:57:30.074764Z",
  "durationSeconds": 470.076394,
  "qVersion": "4.1",
  "resqVersion": "1.8.1",
  "environment": {
    "platform": "Linux-7.1.6-201.fc44.x86_64-x86_64-with-glibc2.43",
    "system": "Linux",
    "release": "7.1.6-201.fc44.x86_64",
    "machine": "x86_64",
    "runnerIdentity": "fedora",
    "pythonVersion": "3.14.6",
    "qExecutable": "/home/greg/.local/bin/q",
    "licensedRuntime": {
      "available": true,
      "credentialMaterialArchived": false,
      "note": "The gate records runtime availability, never licence secrets."
    }
  },
  "qualificationScope": {
    "qualified": [
      "kdb+/q 4.1.x 64-bit on Linux x86-64"
    ],
    "unqualified": [
      "other q 4.x releases",
      "macOS",
      "Windows",
      "optional AxLibraries self-coverage provider",
      "unlisted external codebases and CI providers"
    ]
  },
  "selfSuite": {
    "suiteCount": 187,
    "testCount": 745,
    "assertionCount": 2399,
    "passCount": 744,
    "failCount": 0,
    "errorCount": 0,
    "skipCount": 1,
    "duration": "0D00:01:48.809908750",
    "durationSeconds": 108.8099,
    "testDurationSumSeconds": 108.8099
  },
  "isolatedSuite": {
    "suiteCount": 187,
    "testCount": 745,
    "assertionCount": 2399,
    "passCount": 744,
    "failCount": 0,
    "errorCount": 0,
    "skipCount": 1,
    "duration": "0D00:01:52.028367396",
    "durationSeconds": 112.0284,
    "testDurationSumSeconds": 112.0284
  },
  "suiteReconciliation": {
    "schemaVersion": 1,
    "kind": "resq-suite-reconciliation",
    "status": "pass",
    "modeIndependentSummary": {
      "suiteCount": 187,
      "testCount": 745,
      "passCount": 744,
      "failCount": 0,
      "errorCount": 0,
      "skipCount": 1,
      "assertionCount": 2399
    },
    "testInventorySha256": "61a9d566cd56398cbacc5e42ac5e348357996eb28b8a7d8abfc0ba6038f888ea",
    "stableIdVerdictParity": true,
    "semanticInventoryParity": true
  },
  "differentialCorpus": {
    "loaderSeeds": 400,
    "coverageSeeds": 2000,
    "summary": {
      "suiteCount": 3,
      "testCount": 5,
      "assertionCount": 10,
      "passCount": 5,
      "failCount": 0,
      "errorCount": 0,
      "skipCount": 0,
      "duration": "0D00:02:22.492031052",
      "durationSeconds": 142.492,
      "testDurationSumSeconds": 142.492
    }
  },
  "preprocessingBudget": {
    "environment": {
      "platform": "Linux-7.1.6-201.fc44.x86_64-x86_64-with-glibc2.43",
      "python": "3.14.6"
    },
    "kind": "resq-review-benchmark",
    "loader": [
      {
        "expectations": 50,
        "preprocessSeconds": 0.12242
      },
      {
        "expectations": 100,
        "preprocessSeconds": 0.235312
      },
      {
        "expectations": 200,
        "preprocessSeconds": 0.500435
      }
    ],
    "loaderGrowthRatios": [
      1.92217,
      2.126687
    ],
    "report": {
      "bytes": 24082357,
      "bytesPerTest": 2408.2357,
      "failureEvery": 0,
      "peakBytes": 93842695,
      "tests": 10000,
      "wallSeconds": 1.624074
    },
    "schemaVersion": 1
  },
  "coverage": {
    "functionsFound": 20,
    "functionsHit": 14,
    "linesFound": 59,
    "linesHit": 48,
    "statementSitesFound": 72,
    "statementSitesHit": 51,
    "branchesFound": 34,
    "branchesHit": 19,
    "statementInstrumentationPercent": 100,
    "branchInstrumentationPercent": 100
  },
  "coverageReconciliation": {
    "schemaVersion": 1,
    "kind": "resq-coverage-reconciliation",
    "framework": "resQ",
    "frameworkVersion": "1.8.1",
    "matched": true,
    "correctnessRunId": "run_ae144fa216ebb3aff988013d870bbc61",
    "coverageRunId": "run_f5e3310308291d95467a75c012933fd9",
    "manifestDigest": "manifest_3c2336154ff9fd73b5ecf4e2e2ed079f",
    "inventory": {
      "tests": 30,
      "assertions": 61,
      "passes": 30,
      "failures": 0,
      "errors": 0,
      "skips": 0
    },
    "comparedExecutionFields": [
      "testId",
      "caseId",
      "suite",
      "description",
      "file",
      "status",
      "assertsRun"
    ],
    "allowedDifferences": [
      "run identity and timestamps",
      "wall-clock and per-test durations",
      "coverage configuration, diagnostics, events, and artifacts",
      "isolation process metadata"
    ]
  },
  "soak": {
    "schemaVersion": 1,
    "kind": "resq-soak-evidence",
    "status": "pass",
    "qVersion": "4.1",
    "platform": "Linux-7.1.6-201.fc44.x86_64-x86_64-with-glibc2.43",
    "cycles": 20,
    "warmupCycles": 2,
    "watchCycles": 3,
    "fixture": "tests/fixtures/sharding/shard_a.q",
    "limits": {
      "maxUsedGrowthBytes": 16777216,
      "maxHeapGrowthBytes": 67108864,
      "maxSymbolGrowth": 64,
      "maxSymbolBytesGrowth": 65536,
      "maxNamespaceGrowth": 1,
      "maxIpcHandleGrowth": 0,
      "maxOsHandleGrowth": 0
    },
    "observed": {
      "usedGrowthBytes": 3792,
      "heapGrowthBytes": 0,
      "symbolGrowth": 0,
      "symbolBytesGrowth": 0,
      "namespaceGrowth": 0,
      "ipcHandleGrowth": 0,
      "osHandleGrowth": 0
    },
    "samples": [
      {
        "cycle": 1,
        "usedBytes": 3243856,
        "heapBytes": 67108864,
        "symbolCount": 5083,
        "symbolBytes": 259879,
        "namespaceCount": 10,
        "ipcHandleCount": 0,
        "osHandleCount": 5,
        "timerFingerprint": "::"
      },
      {
        "cycle": 2,
        "usedBytes": 3245040,
        "heapBytes": 67108864,
        "symbolCount": 5086,
        "symbolBytes": 259975,
        "namespaceCount": 10,
        "ipcHandleCount": 0,
        "osHandleCount": 5,
        "timerFingerprint": "::"
      },
      {
        "cycle": 3,
        "usedBytes": 3245760,
        "heapBytes": 67108864,
        "symbolCount": 5086,
        "symbolBytes": 259975,
        "namespaceCount": 10,
        "ipcHandleCount": 0,
        "osHandleCount": 5,
        "timerFingerprint": "::"
      },
      {
        "cycle": 4,
        "usedBytes": 3245936,
        "heapBytes": 67108864,
        "symbolCount": 5086,
        "symbolBytes": 259975,
        "namespaceCount": 10,
        "ipcHandleCount": 0,
        "osHandleCount": 5,
        "timerFingerprint": "::"
      },
      {
        "cycle": 5,
        "usedBytes": 3246112,
        "heapBytes": 67108864,
        "symbolCount": 5086,
        "symbolBytes": 259975,
        "namespaceCount": 10,
        "ipcHandleCount": 0,
        "osHandleCount": 5,
        "timerFingerprint": "::"
      },
      {
        "cycle": 6,
        "usedBytes": 3246288,
        "heapBytes": 67108864,
        "symbolCount": 5086,
        "symbolBytes": 259975,
        "namespaceCount": 10,
        "ipcHandleCount": 0,
        "osHandleCount": 5,
        "timerFingerprint": "::"
      },
      {
        "cycle": 7,
        "usedBytes": 3246720,
        "heapBytes": 67108864,
        "symbolCount": 5086,
        "symbolBytes": 259975,
        "namespaceCount": 10,
        "ipcHandleCount": 0,
        "osHandleCount": 5,
        "timerFingerprint": "::"
      },
      {
        "cycle": 8,
        "usedBytes": 3246896,
        "heapBytes": 67108864,
        "symbolCount": 5086,
        "symbolBytes": 259975,
        "namespaceCount": 10,
        "ipcHandleCount": 0,
        "osHandleCount": 5,
        "timerFingerprint": "::"
      },
      {
        "cycle": 9,
        "usedBytes": 3247072,
        "heapBytes": 67108864,
        "symbolCount": 5086,
        "symbolBytes": 259975,
        "namespaceCount": 10,
        "ipcHandleCount": 0,
        "osHandleCount": 5,
        "timerFingerprint": "::"
      },
      {
        "cycle": 10,
        "usedBytes": 3247248,
        "heapBytes": 67108864,
        "symbolCount": 5086,
        "symbolBytes": 259975,
        "namespaceCount": 10,
        "ipcHandleCount": 0,
        "osHandleCount": 5,
        "timerFingerprint": "::"
      },
      {
        "cycle": 11,
        "usedBytes": 3247424,
        "heapBytes": 67108864,
        "symbolCount": 5086,
        "symbolBytes": 259975,
        "namespaceCount": 10,
        "ipcHandleCount": 0,
        "osHandleCount": 5,
        "timerFingerprint": "::"
      },
      {
        "cycle": 12,
        "usedBytes": 3247600,
        "heapBytes": 67108864,
        "symbolCount": 5086,
        "symbolBytes": 259975,
        "namespaceCount": 10,
        "ipcHandleCount": 0,
        "osHandleCount": 5,
        "timerFingerprint": "::"
      },
      {
        "cycle": 13,
        "usedBytes": 3247776,
        "heapBytes": 67108864,
        "symbolCount": 5086,
        "symbolBytes": 259975,
        "namespaceCount": 10,
        "ipcHandleCount": 0,
        "osHandleCount": 5,
        "timerFingerprint": "::"
      },
      {
        "cycle": 14,
        "usedBytes": 3247952,
        "heapBytes": 67108864,
        "symbolCount": 5086,
        "symbolBytes": 259975,
        "namespaceCount": 10,
        "ipcHandleCount": 0,
        "osHandleCount": 5,
        "timerFingerprint": "::"
      },
      {
        "cycle": 15,
        "usedBytes": 3248640,
        "heapBytes": 67108864,
        "symbolCount": 5086,
        "symbolBytes": 259975,
        "namespaceCount": 10,
        "ipcHandleCount": 0,
        "osHandleCount": 5,
        "timerFingerprint": "::"
      },
      {
        "cycle": 16,
        "usedBytes": 3248816,
        "heapBytes": 67108864,
        "symbolCount": 5086,
        "symbolBytes": 259975,
        "namespaceCount": 10,
        "ipcHandleCount": 0,
        "osHandleCount": 5,
        "timerFingerprint": "::"
      },
      {
        "cycle": 17,
        "usedBytes": 3249024,
        "heapBytes": 67108864,
        "symbolCount": 5086,
        "symbolBytes": 259975,
        "namespaceCount": 10,
        "ipcHandleCount": 0,
        "osHandleCount": 5,